{
  "$schema": "https://json-schema.org/draft/2020-12/schema",
  "$id": "https://assayrecord.ai/schema/assay-record-0.1.schema.json",
  "title": "Assay Record proof file, draft 0.1",
  "description": "One record per file. The fingerprints are recomputed by every verifier from the content; they are never trusted as written. See https://assayrecord.ai/spec.html",
  "type": "object",
  "required": ["format", "version", "record_id", "issuer", "origin", "issued_at", "content", "proof"],
  "properties": {
    "format": { "const": "assay-record" },
    "version": { "type": "string", "pattern": "^0\\.1(-draft)?$" },
    "record_id": { "type": "string", "pattern": "^[A-Z]{2,6}-\\d{6}-\\d{6}-[0-9A-HJKMNP-TV-Z]{4}-[0-9A-HJKMNP-TV-Z]{4}-[0-9A-HJKMNP-TV-Z]{4}$" },
    "issuer": { "type": "string", "pattern": "^[A-Z]{2,6}$" },
    "origin": { "enum": ["generated", "registered"] },
    "issued_at": { "type": "string", "format": "date-time" },
    "assessment": {
      "type": "object",
      "properties": {
        "protocol": { "type": "string" },
        "model": { "type": "string" },
        "assistant": { "type": "string" },
        "language": { "type": "string" }
      },
      "additionalProperties": false
    },
    "content": {
      "type": "object",
      "required": ["project", "context", "report"],
      "properties": {
        "project": { "type": "string" },
        "context": { "type": "string" },
        "report": { "type": "string" }
      },
      "additionalProperties": false
    },
    "proof": {
      "type": "object",
      "required": ["fingerprint", "seal"],
      "properties": {
        "fingerprint": { "$ref": "#/$defs/fingerprint" },
        "seal": {
          "type": "object",
          "required": ["value"],
          "properties": {
            "value": { "$ref": "#/$defs/sealOrEmpty" },
            "verify": { "type": "string", "format": "uri" }
          }
        }
      }
    },
    "follow_up": {
      "type": "object",
      "required": ["profile", "verified_by", "checked", "questions", "decision", "conditions", "place", "signature", "proof"],
      "properties": {
        "profile": { "const": "riftveil-decision-v1" },
        "verified_by": {
          "type": "object",
          "required": ["last_name", "first_name", "role"],
          "properties": {
            "last_name": { "type": "string" },
            "first_name": { "type": "string" },
            "role": { "type": "string" }
          },
          "additionalProperties": false
        },
        "checked": { "type": "string" },
        "questions": {
          "type": "array",
          "items": {
            "type": "object",
            "required": ["n", "question", "suggested_owner", "assigned_to"],
            "properties": {
              "n": { "type": "integer", "minimum": 1 },
              "question": { "type": "string" },
              "suggested_owner": { "type": "string" },
              "assigned_to": { "type": "string" }
            },
            "additionalProperties": false
          }
        },
        "decision": { "enum": ["", "proceed", "conditions", "stop"] },
        "conditions": { "type": "string" },
        "place": { "type": "string" },
        "signature": {
          "type": "object",
          "required": ["method", "typed", "image"],
          "properties": {
            "method": { "enum": ["", "drawn", "typed"] },
            "typed": { "type": "string" },
            "image": { "type": "string", "pattern": "^(|data:image/png;base64,[A-Za-z0-9+/=]+)$" }
          },
          "additionalProperties": false
        },
        "decided_at": { "type": "string", "format": "date-time" },
        "proof": {
          "type": "object",
          "required": ["fingerprint", "seal"],
          "properties": {
            "fingerprint": { "$ref": "#/$defs/fingerprint" },
            "seal": {
              "type": "object",
              "properties": {
                "value": { "$ref": "#/$defs/sealOrEmpty" },
                "sealed_at": { "type": "string", "pattern": "^(|\\d{4}-\\d{2}-\\d{2}T\\d{2}:\\d{2}:\\d{2}Z)$" },
                "verify": { "type": "string", "format": "uri" }
              }
            }
          }
        }
      }
    },
    "notice": { "type": "string" }
  },
  "$defs": {
    "fingerprint": {
      "type": "object",
      "required": ["alg", "profile", "value"],
      "properties": {
        "alg": { "const": "sha-256" },
        "profile": { "type": "string" },
        "value": { "type": "string", "pattern": "^([0-9a-f]{64})?$" }
      }
    },
    "sealOrEmpty": { "type": "string", "pattern": "^(|S\\d{1,2}-([0-9A-HJKMNP-TV-Z]{4}-){7}[0-9A-HJKMNP-TV-Z]{4})$" }
  }
}
